[
    {
        "id": "chesed",
        "hebrew_root": "חֶסֶד",
        "transliteration": "cḥesed",
        "testament_scope": "both",
        "semantic_domain": "god-covenant",
        "textual_layer": "pre-exilic",
        "watch_point_flag": true,
        "status": "approved",
        "license": "MIT",
        "version": "1.1.0",
        "last_updated": "2026-04-07",
        "category_label": "Covenant Loyalty / Steadfast Love",
        "one_liner": "Chesed is the living sinew of covenant — the enacted faithfulness that holds the bond between YHWH and Israel from the inside.",
        "full_definition": "Chesed names the quality of faithfulness that is intrinsic to covenant relationship and that expresses itself as sustained, concrete loyalty in action. It is not sentiment or disposition alone but the enacted content of the covenant bond — what it looks like when YHWH or Israel actually lives within the terms of their binding relationship. When YHWH shows chesed, he is not exceeding the covenant's demands; he is inhabiting them fully, expressed as rescue, remembrance, and pursuit. The word carries the density of a relationship that has history, obligation, memory, and future horizon all compressed into a single present act of faithfulness.\n\nThe root implies not only loyalty but the covenant structure itself generates an orientation toward the vulnerable partner — not as emotional stooping but as the form faithful loyalty necessarily takes when one party holds greater power within the bond. This is why chesed appears so often in contexts of rescue and restoration: YHWH's chesed toward Israel is inseparable from Israel's covenant history of failure and return. Chesed does not cancel obligation; it is the form obligation takes when it is enacted by a whole person rather than performed mechanically — expressed concretely as the act of returning, restoring, and holding open. In the Psalms especially, chesed is the ground beneath the suppliant's feet — the reason appeal to YHWH is not futile even from the depths.\n\nChesed has a communal and horizontal dimension as well. Micah 6:8 places it alongside justice and humility as the summary of what YHWH requires of Israel — chesed here is not charity but the faithful loyalty that members of the covenant community owe one another. Hosea's devastating indictment that there is 'no chesed in the land' (Hos 4:1) is a description of covenant dissolution from within: when chesed collapses, the community's binding tissue is gone. The word thus operates at every level — divine-human, human-human, familial, political — wherever covenant structure exists and requires living out.\n\nIn the Septuagint, chesed is most frequently rendered eleos, which carries connotations of mercy toward the suffering — a narrowing that already begins the drift from covenantal loyalty toward unilateral compassion. The fuller Hebrew category, however, always presupposes a structured relationship as the context within which the quality of chesed operates and makes sense.",
        "what_it_does": "Chesed holds the covenant together from the inside when external pressure, failure, or distance would otherwise fracture it. It acts: it rescues the perishing partner, it remembers the covenant when the other party has forgotten, it pursues the one who has strayed. Chesed is what David appeals to when he has no claim left but the relationship itself (Ps 51:1). It is what Ruth performs toward Naomi when every social obligation has technically expired (Ruth 1:8, 3:10). It sustains the covenant not by ignoring its structure but by animating that structure with full personal investment expressed as concrete acts of loyalty. In liturgical use, the refrain 'his chesed endures forever' (Ps 136) is not mere sentiment — it is a recitation of the covenant's durability through the entire sweep of Israel's history, anchoring present worship in demonstrated past faithfulness.",
        "what_it_is_not": "Chesed is not mercy in the sense of a judge's discretionary compassion toward the suffering — unilateral, relational only in the direction of need — which is what the Latin theological tradition came to mean by misericordia (mercy understood as the pathos of a superior moved by another's misery). Chesed is the interior life of an existing bond: it is what loyal love looks like when covenant partners — especially the stronger one — hold the relationship together through every circumstance the covenant traverses, expressed as rescue, remembrance, and return.",
        "second_temple_context": "In the synagogue and Torah-centered life of Second Temple Judaism, chesed was encountered primarily through the daily and Sabbath recitation of psalms, the reading of Torah, and the liturgical memory of YHWH's acts toward Israel. The Amidah and the Shema's surrounding blessings drew heavily on chesed language, framing Israel's ongoing relationship with YHWH as a covenant sustained by his demonstrated faithfulness across generations. The Eighteen Benedictions invoke YHWH as 'the one who remembers the chesed of the fathers' — rooting present petition in the covenant's accumulated history rather than in merit.\n\nAt Qumran, chesed language appears in the Hodayot (Thanksgiving Hymns) and the Community Rule in the context of covenantal observance and eschatological faithfulness: YHWH's chesed is the ground of the community's covenant standing before YHWH in the final age. The Damascus Document frames correct observance of Torah as the community's response to YHWH's chesed — covenant loyalty answered by covenant loyalty. Sirach (Ben Sira) uses chesed to describe both YHWH's faithfulness and the obligations of social solidarity within the Torah community, particularly care for the poor, the widow, and the orphan as acts of lived chesed. For every Second Temple Jewish reader, chesed named the reality that the covenant between YHWH and Israel was not contingent on Israel's performance alone but was held open by YHWH's own character — a truth that simultaneously humbled and emboldened covenant petition.",
        "kardia_rendering": "faithful covenant love",
        "surface_vehicles": {
            "hebrew_lexemes": ["חֶסֶד", "חָסִיד"],
            "strongs_hebrew": ["H2617", "H2623"],
            "lxx_greek": ["eleos", "charis", "dikaiosynē", "agathōsynē"],
            "nt_greek": ["eleos", "charis", "agapē"],
            "strongs_greek": ["G1656", "G5485", "G26"],
            "english_glosses": {
                "recommended": ["steadfast love", "faithful covenant love", "loyal love", "covenant faithfulness in action"],
                "attested": [
                    {
                        "gloss": "mercy",
                        "found_in": ["KJV", "NKJV", "DRA"],
                        "loses": "The covenantal structure within which chesed operates — mercy implies unilateral discretionary clemency rather than faithful loyalty within a binding relationship"
                    },
                    {
                        "gloss": "kindness",
                        "found_in": ["NASB", "NIV", "NLT"],
                        "loses": "The obligatory weight and covenantal context of chesed — kindness suggests voluntary benevolence without relational history or binding structure"
                    },
                    {
                        "gloss": "love",
                        "found_in": ["NIV", "NLT", "GNT"],
                        "loses": "The specific quality of loyalty-within-covenant that distinguishes chesed from generic affection or emotion"
                    },
                    {
                        "gloss": "grace",
                        "found_in": ["older liturgical renderings"],
                        "loses": "The bilateral covenant context — grace in Western theological usage implies purely unilateral divine gift, erasing the relational structure chesed always presupposes"
                    }
                ]
            }
        },
        "illustrative_renderings": [
            {"translation": "ESV", "text": "Psalm 136:1 — 'Give thanks to the LORD, for he is good, for his steadfast love endures forever.'"},
            {"translation": "KJV", "text": "Psalm 136:1 — 'O give thanks unto the LORD; for he is good: for his mercy endureth for ever.'"},
            {"translation": "NIV", "text": "Psalm 136:1 — 'Give thanks to the LORD, for he is good. His love endures forever.'"},
            {"translation": "NKJV", "text": "Psalm 136:1 — 'Oh, give thanks to the LORD, for He is good! For His mercy endures forever.'"},
            {"translation": "CSB", "text": "Psalm 136:1 — 'Give thanks to the LORD, for he is good. His faithful love endures forever.'"}
        ],
        "key_verses": ["Ps.136.1", "Ps.51.1", "Hos.6.6", "Mic.6.8", "Ruth.1.8"],
        "related_categories": ["emunah", "berit", "emet", "rachamim", "tsedaqah", "shalom"],